{
  "$schema": "https://json-schema.org/draft/2020-12/schema",
  "$id": "https://github.com/ndrorchestration/DGAF-Framework/docs/experiment/TRACK_A_EPOCH_002_DATASET_LOCK_EVIDENCE_SCHEMA.json",
  "title": "Track A Epoch 002 content-addressed dataset-lock evidence manifest",
  "description": "Non-authorizing structural-QC evidence produced only after an authorized collection. It binds retained public/protected artifacts without unblinding, decrypting protected mappings, aggregating outcomes, or establishing efficacy.",
  "type": "object",
  "additionalProperties": false,
  "required": [
    "record_type",
    "schema_version",
    "protocol_id",
    "epoch",
    "evidence_tooling_commit_sha",
    "collection_authorization_commit_sha",
    "collection_authorization_blob_sha",
    "frozen_candidate_sha",
    "frozen_candidate_tree_sha",
    "custody_receipt_blob_sha",
    "qc_ledger_record_id",
    "pre_lock_result_ledger_sha256",
    "pre_lock_result_ledger_record_count",
    "paired_seed_units",
    "blinded_observations",
    "public_artifact",
    "protected_artifact",
    "structural_qc",
    "custody_class",
    "independent_custody",
    "outcomes_inspected_for_lock",
    "outcome_aggregation_performed",
    "unblinding_authorized",
    "primary_analysis_authorized",
    "historical_pooling_allowed",
    "epoch_004_substitution_allowed",
    "high_assurance_authorized",
    "scientific_n_increment",
    "canonical_dgaf_efficacy",
    "dataset_lock_evidence_status"
  ],
  "properties": {
    "record_type": {"const": "TRACK_A_EPOCH_002_DATASET_LOCK_EVIDENCE"},
    "schema_version": {"const": 1},
    "protocol_id": {"const": "PDMAL-TRACK-A-TOPOLOGY-ROBUSTNESS-EPOCH-002"},
    "epoch": {"const": 2},
    "evidence_execution_class": {"const": "OPERATOR_CODESPACE"},
    "evidence_workflow_run_id": {"type": "integer", "minimum": 1},
    "evidence_tooling_commit_sha": {"type": "string", "pattern": "^[0-9a-f]{40}$"},
    "collection_execution_class": {"const": "OPERATOR_CODESPACE"},
    "operator_admission_record_sha256": {"type": "string", "pattern": "^[0-9a-f]{64}$"},
    "collection_execution_receipt_sha256": {"type": "string", "pattern": "^[0-9a-f]{64}$"},
    "collection_workflow_run_id": {"type": "integer", "minimum": 1},
    "collection_authorization_commit_sha": {"type": "string", "pattern": "^[0-9a-f]{40}$"},
    "collection_authorization_blob_sha": {"type": "string", "pattern": "^[0-9a-f]{40}$"},
    "frozen_candidate_sha": {"type": "string", "pattern": "^[0-9a-f]{40}$"},
    "frozen_candidate_tree_sha": {"type": "string", "pattern": "^[0-9a-f]{40}$"},
    "custody_receipt_blob_sha": {"type": "string", "pattern": "^[0-9a-f]{40}$"},
    "qc_ledger_record_id": {"type": "string", "pattern": "^[A-Z0-9][A-Z0-9._:-]{7,127}$"},
    "pre_lock_result_ledger_sha256": {"type": "string", "pattern": "^[0-9a-f]{64}$"},
    "pre_lock_result_ledger_record_count": {"const": 53},
    "paired_seed_units": {"const": 50},
    "blinded_observations": {"const": 2250},
    "public_artifact": {
      "type": "object",
      "additionalProperties": false,
      "required": ["name", "size_bytes", "archive_sha256", "manifest_sha256"],
      "properties": {
        "artifact_id": {"type": "integer", "minimum": 1},
        "name": {"const": "track-a-epoch-002-public-blinded"},
        "size_bytes": {"type": "integer", "minimum": 1},
        "archive_sha256": {"type": "string", "pattern": "^[0-9a-f]{64}$"},
        "manifest_sha256": {"type": "string", "pattern": "^[0-9a-f]{64}$"}
      }
    },
    "protected_artifact": {
      "type": "object",
      "additionalProperties": false,
      "required": [
        "name",
        "size_bytes",
        "archive_sha256",
        "ciphertext_sha256",
        "plaintext_tar_sha256",
        "custody_certificate_sha256",
        "custody_certificate_public_key_der_sha256"
      ],
      "properties": {
        "artifact_id": {"type": "integer", "minimum": 1},
        "name": {"const": "track-a-epoch-002-protected-encrypted"},
        "size_bytes": {"type": "integer", "minimum": 1},
        "archive_sha256": {"type": "string", "pattern": "^[0-9a-f]{64}$"},
        "ciphertext_sha256": {"type": "string", "pattern": "^[0-9a-f]{64}$"},
        "plaintext_tar_sha256": {"type": "string", "pattern": "^[0-9a-f]{64}$"},
        "custody_certificate_sha256": {"type": "string", "pattern": "^[0-9a-f]{64}$"},
        "custody_certificate_public_key_der_sha256": {"type": "string", "pattern": "^[0-9a-f]{64}$"}
      }
    },
    "structural_qc": {
      "type": "object",
      "additionalProperties": false,
      "required": [
        "public_archive_digest_verified",
        "protected_archive_digest_verified",
        "all_public_sidecars_verified",
        "whole_epoch_manifest_verified",
        "exact_seed_panel_verified",
        "exact_matrix_counts_verified",
        "public_schema_allowlist_verified",
        "protected_ciphertext_digest_verified",
        "protected_plaintext_not_decrypted",
        "protected_mapping_not_inspected",
        "private_key_not_used"
      ],
      "properties": {
        "public_archive_digest_verified": {"const": true},
        "protected_archive_digest_verified": {"const": true},
        "all_public_sidecars_verified": {"const": true},
        "whole_epoch_manifest_verified": {"const": true},
        "exact_seed_panel_verified": {"const": true},
        "exact_matrix_counts_verified": {"const": true},
        "public_schema_allowlist_verified": {"const": true},
        "protected_ciphertext_digest_verified": {"const": true},
        "protected_plaintext_not_decrypted": {"const": true},
        "protected_mapping_not_inspected": {"const": true},
        "private_key_not_used": {"const": true}
      }
    },
    "custody_class": {"const": "SAME_SYSTEM_NONINDEPENDENT"},
    "independent_custody": {"const": false},
    "outcomes_inspected_for_lock": {"const": false},
    "outcome_aggregation_performed": {"const": false},
    "unblinding_authorized": {"const": false},
    "primary_analysis_authorized": {"const": false},
    "historical_pooling_allowed": {"const": false},
    "epoch_004_substitution_allowed": {"const": false},
    "high_assurance_authorized": {"const": false},
    "scientific_n_increment": {"const": 0},
    "canonical_dgaf_efficacy": {"const": "NOT_ESTABLISHED"},
    "dataset_lock_evidence_status": {"const": "STRUCTURAL_QC_PASS_PENDING_REPOSITORY_RECEIPT"}
  },
  "allOf": [
    {
      "if": {"required": ["evidence_execution_class"]},
      "then": {
        "required": ["evidence_execution_class"],
        "not": {"required": ["evidence_workflow_run_id"]}
      },
      "else": {"required": ["evidence_workflow_run_id"]}
    }
  ],
  "if": {
    "required": ["collection_execution_class"]
  },
  "then": {
    "required": [
      "collection_execution_class",
      "operator_admission_record_sha256",
      "collection_execution_receipt_sha256"
    ],
    "allOf": [
      {"not": {"required": ["collection_workflow_run_id"]}},
      {
        "properties": {
          "public_artifact": {"not": {"required": ["artifact_id"]}}
        }
      },
      {
        "properties": {
          "protected_artifact": {"not": {"required": ["artifact_id"]}}
        }
      }
    ]
  },
  "else": {
    "required": ["collection_workflow_run_id"],
    "properties": {
      "public_artifact": {"required": ["artifact_id"]},
      "protected_artifact": {"required": ["artifact_id"]}
    }
  }
}
