{"blinded_observations":2250,"canonical_dgaf_efficacy":"NOT_ESTABLISHED","collection_authorization_blob_sha":"90b4249c4d2fc2e587db15569fa2c9e4b0174732","collection_authorization_commit_sha":"563152fdb254b8ee948a693c287126a8bf8314b8","collection_execution_class":"OPERATOR_CODESPACE","collection_execution_receipt_sha256":"b0cdbc913167da14290784466f1602b705466cc81268f62c234b1850e3d6ce88","custody_class":"SAME_SYSTEM_NONINDEPENDENT","custody_receipt_blob_sha":"32c248a364cb2bd43454dbec3beee9beccbe547f","dataset_lock_evidence_status":"STRUCTURAL_QC_PASS_PENDING_REPOSITORY_RECEIPT","epoch":2,"epoch_004_substitution_allowed":false,"evidence_execution_class":"OPERATOR_CODESPACE","evidence_tooling_commit_sha":"cae34a3d7c9642da3269e69a2b3121fce78be2dd","frozen_candidate_sha":"7bbd97604d82efada43d0b139901f06eb2582a23","frozen_candidate_tree_sha":"d6c4e94586551880d657ae3464043a08bfc5d8e1","high_assurance_authorized":false,"historical_pooling_allowed":false,"independent_custody":false,"operator_admission_record_sha256":"f3eaa3e220eaf4c08d7938ae07238449a3cf6fa9ced3c856ca8b40bd8e84415c","outcome_aggregation_performed":false,"outcomes_inspected_for_lock":false,"paired_seed_units":50,"pre_lock_result_ledger_record_count":53,"pre_lock_result_ledger_sha256":"c7fc5a5cee24dd50ed69fd6a9131362f3d48bdc3b844d0708af8ff83080ff361","primary_analysis_authorized":false,"protected_artifact":{"archive_sha256":"a40bb53d9c24a6afd996222ab3b275c2385b90245f9b2bb3d942291b104b85cb","ciphertext_sha256":"bbce92721b350b18eb287c0a95dc21365c9b1a061b324af8da2133a922db861f","custody_certificate_public_key_der_sha256":"53d0b2a95b2634ef7011b808657e693df426dcaecf8ad70c8094be20d37c4f08","custody_certificate_sha256":"5d14c89c20e0d22586045dea9fbb5de9a7ec6e7bbe7be4cd5b4da3ce9693db4e","name":"track-a-epoch-002-protected-encrypted","plaintext_tar_sha256":"cf5ac4531810fb96cc418c5f4c33d60b748cefc1b13d4fc50b49834afc85085e","size_bytes":143360},"protocol_id":"PDMAL-TRACK-A-TOPOLOGY-ROBUSTNESS-EPOCH-002","public_artifact":{"archive_sha256":"60f6df2ca67cbf46cf1a7d3537f0ac1c5f5ab3602a15ce0cfbb7162ab9d5215e","manifest_sha256":"d76b1a028dfa57a197c2e0b2108127bf9d6ae8d3755377b19fbae93b7bea0e0b","name":"track-a-epoch-002-public-blinded","size_bytes":860160},"qc_ledger_record_id":"E002:QC:RETROSPECTIVE_OPERATOR","record_type":"TRACK_A_EPOCH_002_DATASET_LOCK_EVIDENCE","schema_version":1,"scientific_n_increment":0,"structural_qc":{"all_public_sidecars_verified":true,"exact_matrix_counts_verified":true,"exact_seed_panel_verified":true,"private_key_not_used":true,"protected_archive_digest_verified":true,"protected_ciphertext_digest_verified":true,"protected_mapping_not_inspected":true,"protected_plaintext_not_decrypted":true,"public_archive_digest_verified":true,"public_schema_allowlist_verified":true,"whole_epoch_manifest_verified":true},"unblinding_authorized":false}
